,Extraction_date,Marketplace,Reference,Status,Name,Address,Size,Size_prefix,Nbr_of_rooms,Nbr_of_baths,Price,Description,URL
1707,2018-07-16T12:51:43,Tunisie-annonce TN,2606299,L,Une belle villa au lac 1,"Tunisie,Tunis,La Marsa,Berge Du Lac",,m²,,,7000.0,"la croisette immobiliére vous propose  ref:vl696   -une superbe spacieuse villa richement meublée, située dans un quartier le plus chic et commercial des berges du lac 1 dans une résidence sécurisée. la villa bénéficie des caméras de surveillance avec un système d'alarme. elle profite de deux entrées indépendantes, le premier accès donne sur un rez de chaussée composé d'une chambre, un salon et salle à manger spacieux et lumineux qui ouvrent sur une belle piscine et un jardin gazonné entouré par des arbustes et une cuisine qui ouvre sur une superbe terrasse, vue sur piscine et qui est agencée de rangements fonctionnels et entièrement équipée d'un four électrique, d'une hotte aspirante, d'une plaque de cuisson, d'un four à micro-ondes , d'un lave-vaisselle et un frigo américain. la partie jour est complétée par une salle d'eau pour les invités. le deuxième accès nous mène à l'étage qui est composé d'une grande suite royale composée d'une chambre, une salle de bain, un salon et une salle de sport, une suite composée d'un muni salon et autre chambre à coucher et une salle de bain.",http://www.tunisie-annonce.com/DetailsAnnonceImmobilier.asp?cod_ann=2606299
1722,2018-07-16T12:51:03,Tunisie-annonce TN,2672423,L,Rdc d'appartement à fouchana prés du carefour,"Tunisie,Ben arous,Fouchana,Fouchana",120,m²,,,440.0,"a louer rdc d'appartement indépendant à fouchana prés du carefour contient 2 chambres et salon+terrasse+salle de bain+ grand cuisine , proche de l' école et transport etc  express immobilière : 22161771",http://www.tunisie-annonce.com/DetailsAnnonceImmobilier.asp?cod_ann=2672423
1733,2018-07-16T12:50:38,Tunisie-annonce TN,2757785,L,Emplacement idéal d'un étage villa,"Tunisie,Ariana,Ariana Ville,El Menzah 6",200,m²,,,1200.0,"a louer un grand étage de villa s+5 standing normal avec chauffage central et garage aéré, dans un quartier chic sur l'artère principale entre menzah 6 et menzah 7.  il est composé : d'une petite terrasse à l'entrée, d'un immense salon salle à manger, d'un beau séjour vitré, d'un long couloir équipé entièrement de rangements, d'une belle cuisine équipée, d'une salle d'eau, d'une autre salle de bain, d'une grande terrasse et de 4 chambres avec placards.  loyer 1200 dt/mois et un mois de cautionnement.  droit de visite : 10 dt.  pour plus d'infos. veuillez contacter le 29 200 004.",http://www.tunisie-annonce.com/DetailsAnnonceImmobilier.asp?cod_ann=2757785
1737,2018-07-16T12:50:32,Tunisie-annonce TN,2814104,L,Local commercial à el menzah 9,"Tunisie,Tunis,El Menzah,El Menzah 9",50,m²,,,900.0,je mets en location un très beau local commercial situé à el menzah 9 juste à coté de centre makni.    superficie: 50 mètres carrés    je serais ouvert à toutes proposition sauf les cafette et les fast food    appelez le 98337517 pour plus de detail,http://www.tunisie-annonce.com/DetailsAnnonceImmobilier.asp?cod_ann=2814104
1761,2018-07-16T12:49:36,Tunisie-annonce TN,2782248,L,Opportunity immo loc show room la soukra,"Tunisie,Ariana,La Soukra,La Soukra",1200,m²,,,14000.0,"opportunity immobilière met a votre disposition la location :    d'un show room  vip repartis sur 3 niveaux de 400m2 chacun sur la route principal au rez de chaussée d'un immeuble moderne haut security et chic avec double ascenseur et souble sortie security a la soukra sur route principal     installation poussée (climatisation camera,alarme)    1200m2    la soukra .     ( la possibilite de louer 800m2 seulement est possible ou 400m2 )       prix global  : 14000dt/mois    pour plus d'informations : 25489997 - 28368558 - 25488313",http://www.tunisie-annonce.com/DetailsAnnonceImmobilier.asp?cod_ann=2782248
1782,2018-07-16T12:48:50,Tunisie-annonce TN,2613755,L,Une villa à gammarth ref vl728,"Tunisie,Tunis,La Marsa,Gammart",1,m²,,,8000.0,la croisette immobiliére vous propose  ref:vl728  a louer une villa à gammarth s composé comme suit :  rez de chaussé:  * un grand jardin avec une grande piscine et terrasse   * un garage  * un grand salon et salle à manger ouvrant sur le jardin   * une grande cuisine complètement équipé   *  3 suite junior.,http://www.tunisie-annonce.com/DetailsAnnonceImmobilier.asp?cod_ann=2613755
1787,2018-07-16T12:48:38,Tunisie-annonce TN,2341177,L,Un dépôt ou plateau à la marsa al1647,"Tunisie,Tunis,La Marsa,Cite Du Stade",450,m²,,,4500.0,"la croisette - agence immobilière à la marsa vous propose:  ref: al1647    a louer un dépôt de 450 m² sur la route du relais composé de deux bureaux, deux salles de bain et une kitchenette.",http://www.tunisie-annonce.com/DetailsAnnonceImmobilier.asp?cod_ann=2341177
1792,2018-07-16T12:48:27,Tunisie-annonce TN,2771608,L,Local commercial,"Tunisie,Ariana,Ariana Ville,Cite Ennasr 2",22,m²,,,1000.0,particulier loue un local commercial sur une grande voie(avenue nouvelle ère)  prix : 1000 dinars par mois avec un pas de porte.  pour plus d'information contacter: 51 111 805,http://www.tunisie-annonce.com/DetailsAnnonceImmobilier.asp?cod_ann=2771608
1803,2018-07-16T12:48:03,Tunisie-annonce TN,2761364,L,Une villa sise a la marsa corniche ref vl870,"Tunisie,Tunis,La Marsa,Marsa Safsaf",,m²,,,5500.0,"la croisette agence immobilière la marsa vous propose ref vl870 à louer une villa sise à la marsa corniche avec piscine à deux pas de la mer.    la villa se compose d'un joli salon avec cheminée, une salle à manger, une cuisine  équipée, une suite parentale, de deux chambres à coucher     et salle de bain.    le rez de jardin est un appartement aménagé qui se compose de deux chambres à coucher, une salle de bain, un salon et une kitchenette.",http://www.tunisie-annonce.com/DetailsAnnonceImmobilier.asp?cod_ann=2761364
1813,2018-07-16T12:47:42,Tunisie-annonce TN,2213217,L,Villa haut standing à la marsa,"Tunisie,Tunis,La Marsa,Marsa Safsaf",500,m²,,,3500.0,"a louer une belle villa à la marsa, sur deux niveaux , situé dans un endroit résidentiel , composée :    au rez de chaussée: d'un salon avec une porte fenêtre coulissante donnant sur la piscine , une salle à manger, une salle d'eau et une cuisine bien équipée     a l'étage : trois chambres à coucher équipée avec dressing et deux salles de bain    extérieur: jardin avec une piscine et un garage     la villa est équipée d'une climatisation et du chauffage central",http://www.tunisie-annonce.com/DetailsAnnonceImmobilier.asp?cod_ann=2213217
1816,2018-07-16T12:47:36,Tunisie-annonce TN,2804748,L,Charmante villa dans la zone touristique,"Tunisie,Tunis,La Marsa,Gammart",1,m²,,,5000.0,"a louer une villa de charme à gammarth supérieur(zone touristique) , dans une résidence gardée et calme , sur deux niveaux, composée :    au rez de chaussée : d'un salon avec une porte fenêtre coulissante donnant sur le jardin et la piscine , une salle à manger , deux suites (deux chambres à coucher avec deux salles de bain et des dressings ) et une cuisine équipée    a l'étage : trois suites    beau jardin avec une piscine et un garage    la villa est équipée d'une climatisation et du chauffage central    pour plus d'information veuillez contactez l'agence sur le 28167167",http://www.tunisie-annonce.com/DetailsAnnonceImmobilier.asp?cod_ann=2804748
1824,2018-07-16T12:47:25,Tunisie-annonce TN,2450724,L,Un joli duplex à la marsa ref al1943,"Tunisie,Tunis,La Marsa,Cite Des Juges 2",1,m²,,,2000.0,"la croisette immobiliére vous propose:  ref:al1943  a louer un joli duplex à la marsa composé comme suit:  a l’extérieur;un jardin avec garage .  au rez de chaussé;un salon donnant sur le jardin ,une salle d’eau ,une cuisine et une chambre de service.  au 1 ér étage ;une salle de bain,2 chambres à coucher,une suite parentale avec une salle de bain et du dressings",http://www.tunisie-annonce.com/DetailsAnnonceImmobilier.asp?cod_ann=2450724
1830,2018-07-16T12:47:14,Tunisie-annonce TN,2818645,L,Villa charmante et prestigieuse,"Tunisie,Ariana,La Soukra,La Soukra",500,m²,,,2500.0,diar el marsa vous offre une location annuel d'une jolie villa s3  ayant une architecture moderne et charmante,http://www.tunisie-annonce.com/DetailsAnnonceImmobilier.asp?cod_ann=2818645
1836,2018-07-16T12:47:04,Tunisie-annonce TN,2796071,L,Ne pas raté,"Tunisie,Ariana,La Soukra,Charguia 2",423,m²,,,4000.0,"2 étages séparé situé a l'immeuble hadhara charguia 2 ''open space'' chaque étage superficie 423m près tous les commodité ( arrêt de bus ,resto ,café ) il est bien aménagé sécurisé ,syndic, climatisé",http://www.tunisie-annonce.com/DetailsAnnonceImmobilier.asp?cod_ann=2796071
1861,2018-07-16T12:46:05,Tunisie-annonce TN,2764219,L,Duplex jumelée  s plus 4 chotrana 1,"Tunisie,Ariana,La Soukra,Chotrana 1",200,m²,,,1200.0,"le duplex se compose de 2 niveaux :   -un rdc : se composant d’un salon et salle à manger, une chambre,   une cuisine bien équipée (plaque, four , hotte ) avec un grand séchoir et une salle d’eau , un jardin entourée du duplex et une place pour voiture  .1 er étage : se composant de 3 chambres à coucher enfants avec dressing avec leur salle de bain commune  autres commodités: chauffage centrale, interphone",http://www.tunisie-annonce.com/DetailsAnnonceImmobilier.asp?cod_ann=2764219
1868,2018-07-16T12:45:47,Tunisie-annonce TN,2814245,L,Une somptueuse villa avec une piscine à la soukra,"Tunisie,Ariana,La Soukra,La Soukra",700,m²,,,6500.0,"réf: sl041   a la soukra dans l'un des plus beaux et agréable quartiers, nous mettons à votre disposition la location d'une somptueuse villa avec un grand jardin et une piscine qui donne directement sur le golf de la soukra.   l'entrée présente un spacieux salon, un séjour et une salle à manger donnant sur le jardin et la piscine, une cuisine bien aménagée et équipée, une salle d'eau pour les visiteurs, quatre chambres à coucher avec dressings et une salle de bain.  la villa est équipée de chauffage central, climatiseurs, caméra de surveillance et système d'alarme.  aussi elle dispose d'un abri pour deux voitures.   superficie : 700 m² et loyer mensuel: 6500 dt.  pour de plus amples informations veuillez nous contacter:    tel : 20 777 057    fixe : 36 176 777    soukra negoce  inspiré de vos besoins.",http://www.tunisie-annonce.com/DetailsAnnonceImmobilier.asp?cod_ann=2814245
1871,2018-07-16T12:45:33,Tunisie-annonce TN,2773356,L,Villa avec jardin a manar 3,"Tunisie,Tunis,El Menzah,El Manar 2",590,m²,,,6000.0,"on met à la location une villa avec jardin à usage bureautique ou commercial dans un emplacement stratégique et sur artère principal à manar3 d'une superficie de 570m² sur un terrain de 590m².    le sous-sol se compose d'une cuisine agencée avec un coin repas et un débarras, une chambre de service, une salle de bain et une salle de jeux.    le rez de chaussée offre un spacieux salon, un séjour, une cuisine agencée, un jardin d'hiver et une véranda.    le 1er étage dessert une suite avec dressing, trois pièces et une salle de bain.    prix de location à usage bureautique: 6000ttc    prix de location à usage commercial : 7500ttc avec pas de porte.    pour plus d'information veuillez contacter votre conseiller mr zied chakroun (58 309 927 / 71 981 482), négociateur en immobilier, lavitrineimmocom, l'agence immobilière nouvelle génération.",http://www.tunisie-annonce.com/DetailsAnnonceImmobilier.asp?cod_ann=2773356
1874,2018-07-16T12:45:28,Tunisie-annonce TN,2808256,L,Une villa meublée avec piscine à la soukra,"Tunisie,Ariana,La Soukra,La Soukra",600,m²,,,700.0,"réf: sl020  on met à votre disposition la location d'une belle et grande villa très bien meublée et avec piscine  pour courte durée situé dans un quartier très calme et agréable à la soukra.   elle dispose de trois grands salons, une salle à manger, une spacieuse cuisine avec gazinière, des éléments de rangements, une machine à laver, un réfrigérateur et un coin de repas, une chambre de service avec sa salle d'eau et une salle d'eau pour les visiteurs.   à l'étage elle dispose de deux suites junior et une grande suite parentale avec un room dressing et un balcon donnant sur la piscine.    une villa pour vos vacances convenable pour vos jours de repos et divertissement confortable, disposant de toutes les commodités à l'intérieur et à l'extérieur  du chauffage central, climatiseur et télévision dans chaque pièce un système d'alarme, un portail électrique, des stores électriques et un garage.  prix de location pour la nuitée: 700 dt.   pour plus d'informations contactez nous.  tel : 20 777 057  fixe : 36 176 777    soukra négoce",http://www.tunisie-annonce.com/DetailsAnnonceImmobilier.asp?cod_ann=2808256
1885,2018-07-16T12:45:03,Tunisie-annonce TN,2347268,L,Une jolie villa à la soukra,"Tunisie,Ariana,La Soukra,La Soukra",1,m²,,,2000.0,"la croisette - agence immobilière à la marsa vous propose:   ref: vl569  a louer une jolie villa avec un grand jardin à la soukra composée comme suit :  -au rez de chaussée : un salon , salle à manger , séjour , une cuisine équipée et une salle de bain .  -a l'étage : deux salons , une suite parentale , 2 chambres à coucher et une salle de bain .",http://www.tunisie-annonce.com/DetailsAnnonceImmobilier.asp?cod_ann=2347268
1889,2018-07-16T12:44:52,Tunisie-annonce TN,2768974,L,Al un bureau au berge du lac1,"Tunisie,Tunis,La Marsa,Berge Du Lac",130,m²,,,1550.0,"a louer un bureau au berge du lac1 dans une résidence bien sécurisé au 2éme étage pour une superficie de 130m² et qui se compose de trois pièces, deux salles d’eaux et kitchenette.   le bureau est équipé de chauffage et climatisation central avec alarme.  prix 1550dt htva/mois loyer et 150dt/mois syndic y compris une place de parking.  tel : 53 540 819 ( agence  idéal immobilier ).",http://www.tunisie-annonce.com/DetailsAnnonceImmobilier.asp?cod_ann=2768974
1903,2018-07-16T12:44:26,Tunisie-annonce TN,2800353,L,Une villa tres haut standing a gammarth ref vl608,"Tunisie,Tunis,La Marsa,Gammart",,m²,,,6500.0,"la croisette agence immobilière à la marsa vous propose ref vl608 à louer une agréable villa s+3  très haut standing sise à gammarth avec une belle piscine à débordement, un jardin qui fait le tour de la maison, et un garage    le rez- de-chaussée comprend un salon qui se fond avec le séjour le tout donne sur la piscine et le jardin, une cuisine moderne et entièrement équipée qui donne sur une verrière extérieure, une salle d’eau invités, une grande suite parentale avec sa salle de bain privative et deux suites junior.  toutes les chambres ont un accès au jardin.    au rez de jardin on trouve un garage, une chambre de gardien, une chambre de service avec salle d’eau et douche, un débarras et une buanderie    la battisse est équipée de chauffage central et climatiseurs dans toutes les pièces.",http://www.tunisie-annonce.com/DetailsAnnonceImmobilier.asp?cod_ann=2800353
1910,2018-07-16T12:44:00,Tunisie-annonce TN,2786327,L,Un duplex sis a sidi bou said ref al2950,"Tunisie,Tunis,Carthage,Sidi Bousaid",1,m²,,,2400.0,"la croisette immobilière met à la location un duplex s+3 indépendant au rdc sis à sidi bou said.  le rez-de-chaussée est composé d’un salon, une cuisine équipée, une chambre à coucher,une salle de douche et une grande terrasse.  le premier étage est composée de deux chambres à coucher avec une salle de bain.  le duplex est doté d’une climatisation.",http://www.tunisie-annonce.com/DetailsAnnonceImmobilier.asp?cod_ann=2786327
1914,2018-07-16T12:43:49,Tunisie-annonce TN,778519,L,Belle villa avec piscine,"Tunisie,Sousse,Hammam Sousse,El Kantaoui",1200,m²,,,4000.0,"bâtie sur un terrain de 1200m² ,900m² couverts répartis en 3 niveaux   rez de jardin ,rdc ,étage ,de style américain villa haut-standing   mise à la location ,situé à la cité narjess el kantaoui à h-sousse   villa comprenant au rez de jardin ,trés grande cuisine agencée et bien équipée,grand sellier ,salle d'eau, grand salon, salle à manger .  au rdc  ,1 suite pour invités ,grand salon avec bée-vitrée et salle à  manger donnant sur une terrasse et la piscine ,salle d'eau .  à l'étage 3 suites, 1 ch ,salle de bain , dépendences éxtérieures,  piscine ,jardin tout autour,garage ,entrée de voitures,chauffage central,et climatisation .prix demandé 4000dt/mois .  infos et visite contactez svp l'immobilière du lac à h-sousse au   00 216 73 370 942.où 00 216 99 904 113.",http://www.tunisie-annonce.com/DetailsAnnonceImmobilier.asp?cod_ann=778519
1924,2018-07-16T12:43:25,Tunisie-annonce TN,2829539,L,Étage de villa hs,"Tunisie,Manouba,Mannouba,La Mannouba",120,m²,,,700.0,"votre agence dream house manouba propose deux étage hs ( 1er étage + 2éme étage ) à manouba, cité calme et résidentiel, prés de tt commodités, 150 m², chaque étage est composé de :    grand salon + 3 chambres à coucher dont 2 avec placard + cuisine équipée ( 2éme étage) avec séchoir + sdb + salle d'eau + balcon + chauffage central + gaz de ville + interphone + système de sécurité isolation sonore et thermique    loyer mensuel : 700 dt / mois    n'hésitez pas de nous contactez:    20 dt frais de visite et 5% commission du logement annuelle    tel :52344101 / 93021179 / 70605867    adresse : avenue l'uma manouba centre",http://www.tunisie-annonce.com/DetailsAnnonceImmobilier.asp?cod_ann=2829539
1930,2018-07-16T12:42:50,Tunisie-annonce TN,2831870,L,Maisonette a cote de la plage,"Tunisie,Tunis,La Goulette,Kheireddine",60,m²,,,400.0,petite maisonnette pres de la plage location hedomadaire,http://www.tunisie-annonce.com/DetailsAnnonceImmobilier.asp?cod_ann=2831870
1935,2018-07-16T12:42:35,Tunisie-annonce TN,2831868,L,Local commercial ou magasin ou depot,"Tunisie,Sfax,Sakiet Eddaier,Sakiet Eddaier",100,m²,,,700.0,"magasin ou depot ou usine a louer , avenue lycee sadak feki a 60 metres de la route principale kassas bou ali (3 eme position) , surface 100 m2 , peut se diviser sur 4 magasins , 4 portes rideaux motorises .",http://www.tunisie-annonce.com/DetailsAnnonceImmobilier.asp?cod_ann=2831868
1950,2018-07-16T12:41:47,Tunisie-annonce TN,2786353,L,Un open space a usage bureautique ref lc031,"Tunisie,Tunis,La Marsa,Berge Du Lac",270,m²,,,250.0,la croisette agence immobilière à la marsa vous propose ref lc031 à louer un rez-de-chaussée open-space de 270m² à usage bureautique sis au lac 2.  il bénéficie d'un block sanitaire et de deux places parking.,http://www.tunisie-annonce.com/DetailsAnnonceImmobilier.asp?cod_ann=2786353
1966,2018-07-16T12:41:07,Tunisie-annonce TN,2785033,L,Lumineuse et agréable villa s plus4 avec jardin,"Tunisie,Ariana,Ariana Ville,El Menzah 6",650,m²,,,2500.0,"agence clic immo   met à votre disposition la location d'une lumineuse et agréable villa rénovée disposant d'un jardin,un garage et un abri pour 3 voitures.    au rez-de-chaussée : un salon , une salle à manger, une salle d’eau invités, une cuisine équipée et une chambre.  a l’étage : une suite parentale, deux chambres qui partagent une salle de bain et une terrasse.    la villa est dotée de 5 climatiseurs split,chauffage central et un système d’alarme.    honoraires de l'agence : 5% du loyer annuel.     pour de plus amples renseignements, n'hésitez pas à nous contacter au 29.427.737 / 29.427.222.",http://www.tunisie-annonce.com/DetailsAnnonceImmobilier.asp?cod_ann=2785033
1984,2018-07-16T12:40:13,Tunisie-annonce TN,2802508,L,Standing  villa  a  sidi bou said,"Tunisie,Tunis,Carthage,Sidi Bousaid",300,m²,,,3000.0,"loue une standing villa  au  cœur  de  sidi  bou said , avec  une  spacieuse  jardin , dans  un  emplacement   calme  et  sécurisé , location  pour l'année  , loyer : 3000 d / mois  , tél : 29  318  386",http://www.tunisie-annonce.com/DetailsAnnonceImmobilier.asp?cod_ann=2802508
1990,2018-07-16T12:39:56,Tunisie-annonce TN,2815348,L,Standing  villa a  sidi  bou  said,"Tunisie,Tunis,Carthage,Sidi Bousaid",300,m²,,,3000.0,"loue  une  superbe  spacieuse  villa  grande  salon  salle  a  mangé  , une  suite parentale , trois  chambres (3) a couché ,  au  cœur de  ville  sidi  bou  said , avec  une  spacieuse  jardin , entré pour trois (3)  voitures , dans un emplacement  idéal  calme  est  sécurisé , libre  de  suite , la location pour l'années ,  loyer : 3000  md / mois légèrement  négociable ,   tel :  29  318 386   ou   98  318 386",http://www.tunisie-annonce.com/DetailsAnnonceImmobilier.asp?cod_ann=2815348
1991,2018-07-16T12:39:51,Tunisie-annonce TN,2825342,L,Etage proche rené descartes,"Tunisie,Ariana,Ariana Ville,Cite Ennasr 2",140,m²,,,1050.0,agence le point immobilier met à louer un étage de villa s+3 proche école rené descartes à ennasr 2.  salon avec balcon  cuisine aménagée et séchoir  suite parentale  2 chambres avec placards  salle de bain  garage  chauffage central,http://www.tunisie-annonce.com/DetailsAnnonceImmobilier.asp?cod_ann=2825342
1993,2018-07-16T12:39:45,Tunisie-annonce TN,2782097,L,Open space au rdc 440 m alain savary,"Tunisie,Tunis,Cite El Khadra,Cite Jardins",440,m²,,,5000.0,cet espace de travail se situe dans un immeuble privatif de trois étages. il bénéficie d’une bonne visibilité grâce à son emplacement stratégique dans une zone d'affaires à forte concentration de bureaux et de commerces.     il est composé d'un open space et une salle d’eau. ces multiples baies vitrées lui assure une bonne luminosité et aération.     loyer: 5000 ht,http://www.tunisie-annonce.com/DetailsAnnonceImmobilier.asp?cod_ann=2782097
1995,2018-07-16T12:39:42,Tunisie-annonce TN,2411054,L,Des locaux commerciaux al1812,"Tunisie,Tunis,Ain Zaghouan,Jardins de Carthage",180,m²,,,6000.0,la croisette:agence immobilière à la marsa vous propose  al1812  a louer un local commercial situé au rez de chaussée d'une agréable résidence aux jardins de carthage.,http://www.tunisie-annonce.com/DetailsAnnonceImmobilier.asp?cod_ann=2411054
2001,2018-07-16T12:39:27,Tunisie-annonce TN,2794256,L,Gérance libre d'un hammam,"Tunisie,Ariana,Ariana Ville,Borj El Baccouche",300,m²,,,5000.0,un hammam avec spa et un centre de beauté aménagé et équipé qui sont situé dans un cartier résidentiel et animé,http://www.tunisie-annonce.com/DetailsAnnonceImmobilier.asp?cod_ann=2794256
2008,2018-07-16T12:39:07,Tunisie-annonce TN,2803141,L,S plus 3 hs,"Tunisie,Manouba,Mannouba,La Mannouba",160,m²,,,650.0,"votre agence immobilière dream house manouba vous propose un étage de villa hs, spacieux, à manouba . composé de :   un grand salon + 3 chambres à coucher dont deux avec placard + sdb + salle d'eau + chauffage central + 2 climatiseurs  loyer mensuel : 650 dt / mois  n'hésitez pas de nous contactez:   tel :52344101 / 93021179 / 70605867  20 dt frais de visite et 5% commission du logement annuelle   adresse : avenue l'uma manouba centre",http://www.tunisie-annonce.com/DetailsAnnonceImmobilier.asp?cod_ann=2803141
2012,2018-07-16T12:38:57,Tunisie-annonce TN,2786352,L,Une très belle villa ref vl901,"Tunisie,Tunis,Carthage,Carthage",,m²,,,5000.0,"la croisette agence immobiliere la marsa vous propose ref vl901 à louer une très belle villa s+3 plain pied sise à carthage.  elle est composée de trois chambres à coucher, une salle de bain, une salle de douche, une cuisine équipée et moderne, une piscine, un jardin et une terrasse.",http://www.tunisie-annonce.com/DetailsAnnonceImmobilier.asp?cod_ann=2786352
2016,2018-07-16T12:38:43,Tunisie-annonce TN,2803296,L,Un immeuble au kram,"Tunisie,Tunis,El Kram,Le Kram",1,m²,,,20000.0,"la croisette immobilière vous propose  ref:lcz134  a louer au kram dans la zone industrielle un immeuble r+2 , la location se fait par bloc(2000m²) ou sur la totalité du bâtiment qui fait 4000m² , il est équipé en électricité, ligne téléphonique, eau et gaz, et muni de double ascenseur et  de deux loges de gardien ainsi que  deux entrée parking sous sol.  *location 120dt/m² à l'état actuel.  *location 135dt/m² y compris cloisonnement+climatisation",http://www.tunisie-annonce.com/DetailsAnnonceImmobilier.asp?cod_ann=2803296
2018,2018-07-16T12:38:37,Tunisie-annonce TN,2707344,L,Etage de villa,"Tunisie,Ben arous,El Mourouj,El Mourouj",150,m²,,,470.0,etage de villa   s+3  mourouj6,http://www.tunisie-annonce.com/DetailsAnnonceImmobilier.asp?cod_ann=2707344
2023,2018-07-16T12:38:26,Tunisie-annonce TN,2717748,L,Un café avec fond de commerce ref lc 018,"Tunisie,Tunis,Ain Zaghouan,Ain Zaghouan",1,m²,,,2100.0,"la croisette immobilière vous propose:  ref:lc018  a vendre un fond de commerce d'un café à l'aouina( 350000 dt )sur la route principale, pas loin du kiosque agil de 320 m².",http://www.tunisie-annonce.com/DetailsAnnonceImmobilier.asp?cod_ann=2717748
2044,2018-07-16T12:37:43,Tunisie-annonce TN,2595749,L,Maison plage dar allouche 900,"Tunisie,Nabeul,Kelibia,Dar Allouche",120,m²,,,900.0,"sté bn ammar met en location d'été une maison  (s+2 ), à plage dar allouche ,  kélibia , 2ème degré sur la plage , équipé de toutes les instructions nécessaires .. prix : 900 dt /semaine . pour plus de renseignements contacter : 21 680 406 - 98 512 755",http://www.tunisie-annonce.com/DetailsAnnonceImmobilier.asp?cod_ann=2595749
