,Extraction_date,Marketplace,Reference,Status,Name,Address,Size,Size_prefix,Nbr_of_rooms,Nbr_of_baths,Price,Description,URL
1337,2018-07-16T13:05:50,Tunisie-annonce TN,2798435,L,Villa ariana supérieure,"Tunisie,Ariana,Ariana Ville,Ariana",500,m²,,,850.0,(850d) villa sur un seul niveau et composée essentiellement de:  04 chambres à coucher  01 salon-salle à manger  01 cuisine  01 salle de bain   placards   buanderie  garage pour 04 voitures  grand jardin.  71829455 - 29600916,http://www.tunisie-annonce.com/DetailsAnnonceImmobilier.asp?cod_ann=2798435
1346,2018-07-16T13:05:28,Tunisie-annonce TN,2821977,L,Apprt el mourouj,"Tunisie,Manouba,Mannouba,La Mannouba",90,m²,,,500.0,"votre agence immobilière dream house manouba vous prpose un appartement à el mourouj 1, 2 éme étage, composé de:     salon + 3 chambre à couchers + sdb + cuisine     loyer : 500 dt / mois     n'hésitez pas de nous contactez:   20 dt frais de visite et 5% commission du logement annuelle  tel :52344101 / 93021179 / 70605867  adresse : avenue l'uma manouba centre",http://www.tunisie-annonce.com/DetailsAnnonceImmobilier.asp?cod_ann=2821977
1358,2018-07-16T13:04:53,Tunisie-annonce TN,2825738,L,Etage de villa mourouj1,"Tunisie,Ben arous,El Mourouj,El Mourouj",140,m²,,,600.0,a louer a elmourouj1 dans un cartier tres calme etage de villa spacieux de trois chambres salon salle a manger salle de bain et cuisine.pour plus d.information ou visite veuiller nous appeler au 52138867 ou 9889503 agence essour,http://www.tunisie-annonce.com/DetailsAnnonceImmobilier.asp?cod_ann=2825738
1365,2018-07-16T13:04:34,Tunisie-annonce TN,2778939,L,Studio meublé bardo center,"Tunisie,Tunis,Le Bardo,Le Bardo",111,m²,,,500.0,"studio meublé, entrée indépendante, quartier résidentiel, proximité de toutes commodités, (métro,marché, monoprix, telecom, resto, ..)  une pièce au rez-de-chaussé kitchenette, salle d'eau douche, réfrigérateur,cuisinière avec four, chauffe-eau, gaz de ville, 02 postes tv avec récepteurs parabole , a l'étage une autre pièce a coucher.  disponibilité immédiate.   pas de colocation.  pas sérieux et samsara s'abstenir",http://www.tunisie-annonce.com/DetailsAnnonceImmobilier.asp?cod_ann=2778939
1368,2018-07-16T13:04:30,Tunisie-annonce TN,2811827,L,Promo s plus 1 climatisé vue mer l,"Tunisie,Nabeul,Kelibia,Kelibia",60,m²,,,99.0,"prix selon la période et la durée  très bon rapport qualité/prix/emplacement ...    au coin le plus animé de kelibia:   vue sur fort, manège et mer (el marsa)   - à 0min de l'ambiance de chaque soirée d'été,   - à 1 min à pied du manège,   - 1 min à pied des salons de thé (thalassa, gara,aquarium), des resto,   - à 4 min à pied de la plage el marsa et le nouveau corniche de kélibia   - à 5 min par voiture de plage mansoura     très beau s+1 climatisé, meublé, très propre, au 2ème étage dans une zone calme, sécurisée (caméras de surveillance) et animée emplacement stratégique, situé à cité manège kélibia comprenant:   - climatiseur   - une cuisine,   -salle d'eau et douche,   -chambre à coucher,   - salon+tv satellite,+ garde robe intégré   - un grand terrasse de 120m²     contacter propriétaire (même numéro pour viber, whatsapp et imo) 00216 56 10 32 55",http://www.tunisie-annonce.com/DetailsAnnonceImmobilier.asp?cod_ann=2811827
1400,2018-07-16T13:03:23,Tunisie-annonce TN,2786634,L,Un etage a usage bureautique ref lc049,"Tunisie,Tunis,La Marsa,Berge Du Lac",,m²,,,220.0,"la coisette agence immobilière à la marsa vous propose ref lc049 à louer un étage à usage bureautique au deuxième étage de 350m² à usage bureautique sis au lac 2.  il est composé de trois grand bureaux, une kitchenette, un petit bureau et de deux salles d'eau.  les bureaux bénéficie du chauffage central et de la climatisation en split.",http://www.tunisie-annonce.com/DetailsAnnonceImmobilier.asp?cod_ann=2786634
1402,2018-07-16T13:03:19,Tunisie-annonce TN,2786331,L,Immeuble bureautique et commercial ref lc048,"Tunisie,Tunis,La Marsa,Berge Du Lac",,m²,,,250.0,"la croisette agence immobilière à la marsa vous propose ref lc048 immeuble d’affaire partager entre bureautique et commercial sis au lac2.  le centre est composé d’un terrain de 2800m², d’une surface couverte de 8900m², d’un sous-sol parking de 2600m², d’un parking extérieur, d’un rez-de-chaussée de 1200m² de commerces, de six étages de 1200m² chacun et de 10 appartements par étage, de différentes surfaces et dispositions.    disponible vente de 4500dt hors taxe le mètre carré.  disponible location 250dt hors taxe le mètre carré",http://www.tunisie-annonce.com/DetailsAnnonceImmobilier.asp?cod_ann=2786331
1413,2018-07-16T13:02:59,Tunisie-annonce TN,2831724,L,Villa pied ds l eau meublé,"Tunisie,Ariana,Raoued,Cite Des Juges",400,m²,,,800.0,a louer pour vacance villa pied ds l eau meublé meuble chic et moderne formé de trois etages deux salles de bain climatisé parking grand jardin,http://www.tunisie-annonce.com/DetailsAnnonceImmobilier.asp?cod_ann=2831724
1420,2018-07-16T13:02:40,Tunisie-annonce TN,2326424,L,Un duplex à gammarth ref al1423,"Tunisie,Tunis,La Marsa,Gammart",1,m²,,,2500.0,"la croisette - agence immobilière à la marsa vous propose:   ref: al1423  a louer un joli duplex à gammarth composé comme suit :  -au rez de chaussée : une cuisine équipée , une salle de bain et un petit jardin .  -a l’étage : un salon , une salle de bain , une salle d’eau et une chambre à coucher avec dressing et balcon .",http://www.tunisie-annonce.com/DetailsAnnonceImmobilier.asp?cod_ann=2326424
1424,2018-07-16T13:02:32,Tunisie-annonce TN,2826229,L,Rez de chaussée de villa mourouj6,"Tunisie,Ben arous,El Mourouj,El Mourouj",150,m²,,,650.0,à louer une belle villa au rez de chaussée  de s+3  cuisine vaste et équipée salle de bain salle d'eau veranda entrée indépendante compteurs eau gaz et electricité indépendants à 300 m du mg nouveau pour plus d'infos contactez 55702712 ou20009291,http://www.tunisie-annonce.com/DetailsAnnonceImmobilier.asp?cod_ann=2826229
1430,2018-07-16T13:02:20,Tunisie-annonce TN,2826651,L,Joli duplex meublé à golden tulip,"Tunisie,Tunis,La Marsa,Gammart",150,m²,,,2800.0,"on met à votre disposition un joli duplex meublé à golden tulip pour la location;  composé d’un salon, salle à manger, une salle d’eau, une suite parentale et une cuisine équipée,  a l’étage on retrouve trois chambres à coucher et une salle de bain,  le duplex dispose d’un joli jardin, il est chauffé et climatisé.",http://www.tunisie-annonce.com/DetailsAnnonceImmobilier.asp?cod_ann=2826651
1445,2018-07-16T13:01:41,Tunisie-annonce TN,2784639,L,Une villa jumelee  a gammarth ref vl890,"Tunisie,Tunis,La Marsa,Gammart",1,m²,,,5000.0,"la croisette agence immobilière à la marsa vous propose ref vl890 a louer une villa jumelée s+4 avec piscine et jardin sise à gammarth.  au rez-de-chaussée, il y a un salon, une salle à manger qui donnent sur le jardin et la piscine, une cuisine équipé avec terrasse, et une salle d’eau.  au premier étage, on trouve une suite parentale avec balcon, deux chambres à coucher avec salle de bain commune et d’un espace vie.",http://www.tunisie-annonce.com/DetailsAnnonceImmobilier.asp?cod_ann=2784639
1458,2018-07-16T13:01:11,Tunisie-annonce TN,2813327,L,Une belle villa au lac2 vlz877,"Tunisie,Tunis,La Marsa,Berge Du Lac",900,m²,,,7500.0,"la croisette immobilière vous propose   ref:vlz877  a louer une villa moderne bâtie sur un terrain de 763m² (vide ou meublé ), érigée sur trois niveaux, située dans un quartier résidentiel au lac 2. la villa se compose comme suit: au rez-de-chaussée: un salon spacieux, une salle à manger, une cuisine américaine agencée entièrement équipée donnant sur le jardin, une salle d’eau invités, et une suite parentale avec dressing et salle de bain. a l’étage, une deuxième suite avec dressing et salle d’eau avec douche (jacuzzi), deux chambres à coucher dont une ouvrant sur une grande terrasse, et une salle d’eau avec douche (jacuzzi). le sous-sol est aménagé et comprend un garage qui peut abriter jusqu’à 4 voitures, deux grands débarras, une deuxième cuisine aménagée, entièrement équipée, deux chambres de service partageant une salle d’eau avec douche. l’extérieur est entouré d’un joli jardin et complété par un loge gardien.  possibilité vide : 6500dt",http://www.tunisie-annonce.com/DetailsAnnonceImmobilier.asp?cod_ann=2813327
1459,2018-07-16T13:01:08,Tunisie-annonce TN,2823667,L,Maison pres de geant,"Tunisie,Ariana,Mnihla,Cite Ali Bourguiba",120,m²,,,300.0,"située à la route de bizerte (5min près de oilibya et 10min à géant par voiture), prés d'une école primaire, autre privée et un collège, à louer une maison d'espace couverte de 120m² composé par 2 chambres et une salle spacieuse.    une cuisine comporte un chauffe-eau (et possibilité d'installation du gaz de ville à la demande) et un grand étagère et une salle de bain .    deux halls non couvertes à l'entrée et derrière la maison.    toutes les fenêtres sont équipées par du fer forgé ainsi que la porte d'entrée.    (les photos ont été prises lors de la phase de peinture)",http://www.tunisie-annonce.com/DetailsAnnonceImmobilier.asp?cod_ann=2823667
1461,2018-07-16T13:01:04,Tunisie-annonce TN,2822943,L,Étage de villa,"Tunisie,Ariana,Ariana Ville,Ariana",90,m²,,,700.0,"belle étage de villa s+2 compose de deux chambres dont lune avec placard une  cuisine équipé avec un séchoir,un balcon et un garage avec abri voiture.une entrée indépendante le local et situe dans un cartier calme prés de toute commodité (hôpital mahmoud el matri,magasin aziza,boulangerie,pâtisserie,centre médicale,banque attijari)",http://www.tunisie-annonce.com/DetailsAnnonceImmobilier.asp?cod_ann=2822943
1469,2018-07-16T13:00:46,Tunisie-annonce TN,2818946,L,Etage de villa luxe quartier calme innatendu,"Tunisie,Ariana,Mnihla,Mnihla",164,m²,,,750.0,"joli etage de villa compose d un grand salon, salle a manger, suite parentale avec salle d eau et douche,une 2 eme piece et une salle de bain avec jacuzzi et une cuisne installee. le tout equipe de placards ,de chauffage central et pre -installation climatseur ,satellite et internet.  le local est pres de toutes commodites geant ennaser et  les jardins d el menzah",http://www.tunisie-annonce.com/DetailsAnnonceImmobilier.asp?cod_ann=2818946
1471,2018-07-16T13:00:41,Tunisie-annonce TN,2578496,L,Villa a ennasr 2 wb562,"Tunisie,Ariana,Ariana Ville,Cite Ennasr 2",400,m²,,,2500.0,"a louer pour 2500 dt par mois a ennasr 2 une charmante villa sur 2 niveaux (400m) avec 2 grands ssm , 2 suites et 2 autres cc , chauffage central , garage , jardin (wb562)",http://www.tunisie-annonce.com/DetailsAnnonceImmobilier.asp?cod_ann=2578496
1484,2018-07-16T13:00:06,Tunisie-annonce TN,2744892,L,Al open space au lac 3,"Tunisie,Tunis,El Kram,Le Kram Est",330,m²,,,3200.0,a louer open space situé au 1er étage d'une résidence bureautique au lac 3 (zone industrielle kram)  superficie : 330m2   loyer : 3200d / mois   tel: 53540819 (agence ideal immobilier),http://www.tunisie-annonce.com/DetailsAnnonceImmobilier.asp?cod_ann=2744892
1486,2018-07-16T13:00:05,Tunisie-annonce TN,2682384,L,Une  maison avec piscine et jardin ref  vl 803,"Tunisie,Tunis,Carthage,Cartage Byrsa",,m²,,,2800.0,"la croisette immobilière met à votre disposition en location ref vl803  une maison avec piscine à carthage port punique composée au rez-de-chaussée d’un salon, deux chambres,deux salles d’eau,et d’une cuisine.a l’étage vous trouvez une suite parentale, un séjour, une chambre à coucher, et deux salles de bain ,et à l’extérieur une piscine, un jardin, ainsi qu’une chambre de gardien.  la villa est chauffée et climatisée",http://www.tunisie-annonce.com/DetailsAnnonceImmobilier.asp?cod_ann=2682384
1505,2018-07-16T12:59:17,Tunisie-annonce TN,2819481,L,Maison s plus 2 meublée climatisée pour étudiants,"Tunisie,Bizerte,Bizerte Nord,Cite Hassen Nouri",90,m²,,,440.0,"maison rez de chaussée indépendante; neuve s+2 meublée climatisée,située sur mér à 3 mn du centre ville dans un endroit calme  sécurisée avec gardien et berger allemand + parking   location à partir du 01/09/2018 pour étudiants ou autres",http://www.tunisie-annonce.com/DetailsAnnonceImmobilier.asp?cod_ann=2819481
1519,2018-07-16T12:58:37,Tunisie-annonce TN,2786351,L,Une très belle villa ref vl901,"Tunisie,Tunis,Carthage,Carthage",,m²,,,5000.0,"la croisette agence immobiliere la marsa vous propose ref vl901 à louer une très belle villa s+3 plain pied sise à carthage.  elle est composée de trois chambres à coucher, une salle de bain, une salle de douche, une cuisine équipée et moderne, une piscine, un jardin et une terrasse.",http://www.tunisie-annonce.com/DetailsAnnonceImmobilier.asp?cod_ann=2786351
1522,2018-07-16T12:58:27,Tunisie-annonce TN,2808582,L,Un étage de villa haut standing à la soukra,"Tunisie,Ariana,La Soukra,La Soukra",210,m²,,,2500.0,"réf: sl008  on met à votre disposition la location d'un superbe étage de villa de très haut standing jamais habité au premier étage d'une agréable villa avec une entrée indépendante,situé dans un quartier calme et gardé à la soukra.    on y trouve un spacieux salon lumineux qui donne accès à une belle et très grande terrasse offrant une splendide vue sur la piscine, une cuisine moderne bien aménagée et équipée de plaque, hotte, four avec séchoir, une salle d'eau pour les visiteurs, une chambre de service, 03 chambres à coucher avec dressing et une salle de bain.  l'étage est équipée de chauffage central, climatiseurs et une place parking.   loyer mensuel : 2500 dt.   pour plus d'informations veuillez nous contacter:    tel: 20 777 057    fixe: 36 176 777    soukra négoce.",http://www.tunisie-annonce.com/DetailsAnnonceImmobilier.asp?cod_ann=2808582
1524,2018-07-16T12:58:20,Tunisie-annonce TN,2788553,L,Villa de haut standing avec beau jardin,"Tunisie,Tunis,La Marsa,Gammart",295,m²,,,3650.0,"salon, cuisine, trois salle de bain, trois chambres a coucher, dépendance, garage,",http://www.tunisie-annonce.com/DetailsAnnonceImmobilier.asp?cod_ann=2788553
1527,2018-07-16T12:58:12,Tunisie-annonce TN,2808765,L,Villa tres haut standing,"Tunisie,Tunis,La Marsa,Marsa Safsaf",400,m²,,,7000.0,"grand salon, salle a manger, séjour, coin bureau, une salle d'eau invité, une belle cuisine, petite dépendance, une très belle suite parentale, avec dressing, et salle de bain, une deuxième suite invité, deux chambres enfants avec dresing et salle de douche, alarme, garage, belle piscine,",http://www.tunisie-annonce.com/DetailsAnnonceImmobilier.asp?cod_ann=2808765
1542,2018-07-16T12:57:25,Tunisie-annonce TN,2819613,L,Un spacieux local à ain zaghoun ref lcz141,"Tunisie,Tunis,Ain Zaghouan,Ain Zaghouan",215,m²,,,4500.0,la croisette immobilière vous propose :   ref : lcz141   a louer un spacieux local sur deux niveau de 215m² à ain zaghouan nord coté nestlé.,http://www.tunisie-annonce.com/DetailsAnnonceImmobilier.asp?cod_ann=2819613
1554,2018-07-16T12:56:53,Tunisie-annonce TN,2831271,L,2 maison pied dans l'eaux fatha,"Tunisie,Nabeul,Kelibia,Kelibia",,m²,,,2500.0,"2 maison pied dans l'eaux fatha  s+4  et  s+2  maison still arabesque pieds dans l'eau à coté de fathet chkilia route el mansoura sous le fort de kélibia et à coté les bons lieux de plage el mansoura,accès privé sur une voie.vue magnifique sur la mer pour un ambiance extra avec vos amis ou votre famille.très belle maison de vacances ouvrant sur la mer avec accès direct.l'ensemble est situé sur un vaste terrasse de 200 m². la maison comprend un salon  équipé(plasma..)+ deux chambres à coucher+cuisine( gaz, vaisselles..)+ salle de bain et un douche au terrasse+abri voiture pour 2 ou 3 voitures.   maison s+4 très belle maison de vacances ouvrant sur la mer avec accès direct.l'ensemble est situé sur un vaste terrasse de 150 m². la maison comprend deux salons bien équipé(salon 7 places + salon 4 places)+ deux chambres à coucher(lit deux places) et l'autre chambre (3 lits une place)+cuisine( gaz, vaisselles..)+ salle de bin (chauffe bain )et une douche au terrasse. profitez et réservez dés maintenant pour la saison d été. là ou vous aurez le beau temps plus des photos   sur mon email",http://www.tunisie-annonce.com/DetailsAnnonceImmobilier.asp?cod_ann=2831271
1558,2018-07-16T12:56:43,Tunisie-annonce TN,2810385,L,Maison pieds dans l'eaux fataha chakilia,"Tunisie,Nabeul,Kelibia,Kelibia",200,m²,,,1200.0,maison pieds dans l'eaux s+4 sous le fort de kélibia et à coté les bons lieux de plage el mansoura.vue magnifique sur la mer pour un ambiance extra avec vos amis ou votre famille.très belle maison de vacances ouvrant sur la mer,http://www.tunisie-annonce.com/DetailsAnnonceImmobilier.asp?cod_ann=2810385
1561,2018-07-16T12:56:38,Tunisie-annonce TN,2831767,L,Studio meublé ou sans meuble,"Tunisie,Tunis,El Omrane Superieur,El Omrane Superieur",60,m²,,,350.0,"a louer un studio 2 pièces (2 lit, armoire, table de nuit, tv, un banc, tapis) + une cuisine salle a mangé (table, chaises, réfrigérateur) + séchoir + douche-toilette.    le studio est situé dans une grande villa sécurisé. elle se trouve dans un quartier calme et proche de toutes commodités  prix meublé : 350dt  prix sans meuble : 250dt",http://www.tunisie-annonce.com/DetailsAnnonceImmobilier.asp?cod_ann=2831767
1565,2018-07-16T12:56:32,Tunisie-annonce TN,2595776,L,Villa dar allouche 900,"Tunisie,Nabeul,Kelibia,Dar Allouche",120,m²,,,900.0,"sté bn ammar met en location d'été une maison  (s+3), à plage dar allouche ,  kélibia , 2ème degré sur la plage , équipé de toutes les instructions nécessaires .. prix : 900 dt /semaine . pour plus de renseignements contacter : 21 680 406 - 98 512 755",http://www.tunisie-annonce.com/DetailsAnnonceImmobilier.asp?cod_ann=2595776
1596,2018-07-16T12:55:32,Tunisie-annonce TN,2818725,L,Un superbe duplex s3 à cap gammarth,"Tunisie,Tunis,La Marsa,Gammart",250,m²,,,250.0,"réf: sl094  on met à votre disposition la location d'un superbe duplex s+3 entièrement et bien meublé situé dans à cap gammarth proche de la plage et de toutes commodités et loisirs.   on y trouve un spacieux salon avec une splendide vue sur mer, une cuisine bien aménagée et équipée avec un séchoir, trois chambres à coucher avec dressings et deux salles de bain.   on dispose aussi de chauffage central et climatiseurs.   superficie est de 250 m² et prix de la nuitée : 250dt.  pour plus de renseignements ou pour prendre un rdv de visite veuillez contacter votre conseiller wissem ben khalifa.    tel : 29 777 207  fixe : 36 176 777    soukra négoce.",http://www.tunisie-annonce.com/DetailsAnnonceImmobilier.asp?cod_ann=2818725
1597,2018-07-16T12:55:31,Tunisie-annonce TN,2721933,L,Depot à l'aouina ref lcz027,"Tunisie,Tunis,La Marsa,El Aouina",300,m²,,,2000.0,dépôt tres spacieux  1er partie 30m² liée à une dépot sous-sol 300m² usage pour stockage produit consommable / matiere premiere / produits finis,http://www.tunisie-annonce.com/DetailsAnnonceImmobilier.asp?cod_ann=2721933
1607,2018-07-16T12:55:11,Tunisie-annonce TN,2722657,L,Un local à ain zaghouan wahat,"Tunisie,Tunis,Ain Zaghouan,Ain Zaghouan",1,m²,,,2000.0,la croisette immobilière vous propose  ref:lcz028  a louer un local de 50 m² pour usage commercial dans une zone calme et sécurisé pour toute activité très spacieux  lumineux et bien aéré loyer 2000 dt par mois plus 1 mois de caution et 30 mille dinars pas de porte .,http://www.tunisie-annonce.com/DetailsAnnonceImmobilier.asp?cod_ann=2722657
1629,2018-07-16T12:54:26,Tunisie-annonce TN,2681273,L,Pour salon de thé ou restaurant ou bank,"Tunisie,Tunis,La Goulette,La Goulette",70,m²,,,3000.0,a louer rez de chaussé commercial ou administratif vue sur la mer qui convient rest ou salon de thé ou agence. ........,http://www.tunisie-annonce.com/DetailsAnnonceImmobilier.asp?cod_ann=2681273
1650,2018-07-16T12:53:49,Tunisie-annonce TN,2811910,L,Showroom à yasminette,"Tunisie,Ben arous,Nouvelle Medina,El Yasminette",300,m²,,,2000.0,on met pour location un showroom de 300 m située au 1er étage à yasminette  convient pour toit type de commerce salon de thé showroom pour meuble location de robe ext  pour plus d'information contacter:29 799 366,http://www.tunisie-annonce.com/DetailsAnnonceImmobilier.asp?cod_ann=2811910
1665,2018-07-16T12:53:20,Tunisie-annonce TN,2494315,L,Villa lac pour ambassade,"Tunisie,Tunis,La Marsa,Berge Du Lac",1000,m²,,,8000.0,"a louer une belle villa pour ambassade au lac2 dans un endroit sécurisé.  la villa est sur 2 niveaux soit un grand séjour, un grand salon, cuisine équipée, salle d'eau, bureau a l'etage 2 suites geniors, suite parentale et 2 chambres avec salle de bain commune. un sous sol complet un garage pour 4 voitures.   la maison est équipée de caméra de surveillance et système alarme. chauffage et climatisation centrale.   un grand jardin avec piscine",http://www.tunisie-annonce.com/DetailsAnnonceImmobilier.asp?cod_ann=2494315
1667,2018-07-16T12:53:19,Tunisie-annonce TN,2493955,L,Villa marsa cube,"Tunisie,Tunis,La Marsa,Marsa Safsaf",700,m²,,,6000.0,"a louer une belle villa pied dans l'eau sur 2 niveaux. soit grand séjour, cuisine équipée, salle d'eau, chambre d'invité a l'etage 2 suites et 2 chambres avec salle de bain.   un sous sol. garage, jardin avec piscine.   la maison est équipée de chauffage centrale et climatisation centrale.   prix 6000dt/mois  tel agent : 20230010.  d'autre produits sont disponibles.",http://www.tunisie-annonce.com/DetailsAnnonceImmobilier.asp?cod_ann=2493955
1672,2018-07-16T12:53:08,Tunisie-annonce TN,2831792,L,Local 15m au coeur del menzeh 5,"Tunisie,Ariana,Ariana Ville,El Menzah 5",15,m²,,,600.0,notre agence immobilière smart immo vous propose à la location d'un local de 15m² au coeur d'el menzeh 5  prix : 600dt  visite: 10dt  honnoraires de l'agence : 5% du loyer annuel  les intéressés contactez le 22.222.333,http://www.tunisie-annonce.com/DetailsAnnonceImmobilier.asp?cod_ann=2831792
1681,2018-07-16T12:52:56,Tunisie-annonce TN,2818561,L,Villa haut standing la marsa,"Tunisie,Tunis,La Marsa,Marsa Ennassim",1000,m²,,,7500.0,"à louer une belle villa à la marsa. sur 2 niveaux soit un grand salon, salle à manger,  cuisine équipée,  salle d'eau. à l'étage suite parentale et 3 suites juniors. au rez-de-chaussée chambre de bonne, chambre de gardien, un grand espace aménagé.   piscine et jardin, un garage.   climatisation et chauffage central.   caméra de surveillance.",http://www.tunisie-annonce.com/DetailsAnnonceImmobilier.asp?cod_ann=2818561
1688,2018-07-16T12:52:44,Tunisie-annonce TN,2797181,L,Duplex trois pièces,"Tunisie,Tunis,Ain Zaghouan,Jardins de Carthage",150,m²,,,1350.0,"vous êtes une famille, à la recherche d'une belle maison chaleureuse et accueillante et surtout bien situé?    l'agence immobilière tunisia home vous propose en location un duplexede haut standing .    le duplexe se compose de:    -suites, deux chambres à coucher, un grand salon, une cuisine bien équipée, une salle d'eau, salle de bain commune.  le duplex est équipé d'un climatiseur et un chauffage central.  place de parking au sous sol    pour plus de renseignement ou visite veuillez contacter nous",http://www.tunisie-annonce.com/DetailsAnnonceImmobilier.asp?cod_ann=2797181
1689,2018-07-16T12:52:40,Tunisie-annonce TN,2825731,L,Maison semi collectif,"Tunisie,Ben arous,El Mourouj,El Mourouj",100,m²,,,550.0,a louer a elmourouj3 pres de toutes les commaudites et de station de metro un etage semi collectif de trois chambres  un grand salon salle de bain et cuisine.pour visite veuiller nous appeler au 21934246 ou 52138867 agence immobiliere essour,http://www.tunisie-annonce.com/DetailsAnnonceImmobilier.asp?cod_ann=2825731
1694,2018-07-16T12:52:22,Tunisie-annonce TN,2802251,L,Un local à ain zaghouan nord ref lcz133,"Tunisie,Tunis,Ain Zaghouan,Ain Zaghouan",70,m²,,,1000.0,"la croisette immobilière vous propose  ref:lcz133   a louer à ain zaghouan nord dans une résidence privée ,un local commercial de 70m² à l'état brut avec  trois vitrines donnant sur une route bien animée.",http://www.tunisie-annonce.com/DetailsAnnonceImmobilier.asp?cod_ann=2802251
1702,2018-07-16T12:52:00,Tunisie-annonce TN,2776821,L,Une magnifique villa à la soukra ref vlz863,"Tunisie,Ariana,La Soukra,Chotrana 2",600,m²,,,4000.0,"la croisette immobilière vous propose:  a louer une magnifique villa de 350 m²  s+6 et r+1 à chotrana 2.   elle se compose comme suit:  au rez de chaussée: un hall donnant sur un grand salon et salle à manger avec cheminée, une première cuisine bien équipée, une deuxième cuisine de service,  un séjour, une chambre d'amie et une salle d'eau.  a l'étage: on trouve une suite parentale avec salle de bain et dressing, quatre grandes chambres dont deux avec  dressings, une salle de bain commune.  a l’extérieure: un grand et magnifique jardin de 250 m² avec piscine et un garage pour 2 voitures.  la villa est équipée avec des panneaux photovoltaïques .",http://www.tunisie-annonce.com/DetailsAnnonceImmobilier.asp?cod_ann=2776821
